{
  "candidate_version": "1.0.3",
  "automated_tests": [
    "tests/test_approval_contract.py",
    "tests/test_permission_bypass_matrix.py",
    "tests/test_checkpoint.py",
    "tests/test_memory.py",
    "tests/test_transcript.py",
    "tests/test_ga_config_migrations.py"
  ],
  "command": "JARN_TEST_MODE=1 .venv/bin/pytest -q full 3039-test collection including permissions, guards, approval bypass, checkpoint/session/transcript, migration, and admin CLI contracts",
  "criterion_ids": [
    "AC-SAFE-001",
    "AC-SAFE-002",
    "AC-SAFE-003",
    "AC-SAFE-004",
    "AC-SAFE-005",
    "AC-SAFE-006",
    "AC-SAFE-007",
    "AC-SAFE-008",
    "AC-SAFE-009",
    "AC-SAFE-010",
    "AC-SESSION-001",
    "AC-SESSION-002",
    "AC-SESSION-003",
    "AC-SESSION-004",
    "AC-SESSION-005",
    "AC-SESSION-006",
    "AC-SESSION-007",
    "AC-CONFIG-001",
    "AC-CONFIG-002",
    "AC-CONFIG-003",
    "AC-CONFIG-004",
    "AC-CONFIG-005",
    "AC-CONFIG-006",
    "AC-CONFIG-007"
  ],
  "decisions": [
    "Cross-process failure injection and symlink/partial-write paths are part of the automated result; deletion and undo refuse active/stale state rather than widening scope."
  ],
  "documentation_lookups": [],
  "duration_seconds": 294.46,
  "ended_at": "2026-08-11T19:14:25Z",
  "errors": [],
  "implementation": [
    "src/jarn/permissions",
    "src/jarn/agent/checkpoint.py",
    "src/jarn/memory/sessions.py",
    "src/jarn/config"
  ],
  "limitations": [
    "OS-specific sandbox strength and real power-loss behavior remain platform/release-matrix observations."
  ],
  "platform": {
    "architecture": "arm64",
    "libc": "n/a",
    "os": "macOS",
    "version": "26.5.2"
  },
  "record_id": "LOCAL-SAFETY-DATA-20260811-V103",
  "redaction": {
    "home_path_redacted": false,
    "host_identifier_redacted": false,
    "raw_auth_output_persisted": false,
    "raw_terminal_output_persisted": false,
    "secrets_allowed": false
  },
  "result": "Least-privilege labels/prompts, scoped approvals, bypass matrix, protected secrets, undo preview/stability, crash-safe session lifecycle/export/delete, exact-secret [REDACTED_SECRET] redaction, and transactional config migration/provenance contracts passed.",
  "schema_version": 2,
  "started_at": "2026-08-11T19:09:31Z",
  "status": "passed"
}
