{
  "candidate_version": "1.0.3",
  "automated_tests": [
    "tests/test_installer.py",
    "tests/test_ga_config_migrations.py"
  ],
  "command": "SSH isolated-home install of the exact v1.0.3 source/wheel with the host real global-npm J.A.R.N. first on PATH and a customized schema-0 config, followed by non-billable doctor migration verification",
  "criterion_ids": [
    "UAT-002",
    "AC-UX-011"
  ],
  "decisions": [
    "passed: The initial fresh login and interactive shell resolved the real legacy global-npm command; after installation both resolved the new user-space jarn 1.0.3 command.",
    "passed: The installer returned activation status 10, retained the legacy executable byte-for-byte, and displayed explicit optional-cleanup and never-delete guidance.",
    "passed: The first non-billable doctor run transactionally migrated config version 0 to 3, created exactly one byte-identical backup, and preserved operator comments, custom headers, timeout, routing, permission, theme, and log level.",
    "passed: The first doctor invocation reported the migration transition; a second invocation reported global_status=current, schema 3, the preserved custom route, network.checked=false, and controlled status 1 for the intentionally unresolved credential."
  ],
  "documentation_lookups": [
    "none"
  ],
  "duration_seconds": 124.0,
  "ended_at": "2026-08-13T09:12:33Z",
  "errors": [],
  "implementation": [
    "install.sh",
    "src/jarn/config/migrations.py",
    "src/jarn/doctor/collect.py"
  ],
  "limitations": [
    "This final-candidate UAT transferred the exact v1.0.3 installer source and reproducible wheel into an isolated remote /tmp fixture; the tagged public-URL canary remains a separate release gate.",
    "First-time provider setup was disabled to isolate command collision and config migration behavior; authentication is covered by separate UAT criteria."
  ],
  "platform": {
    "architecture": "x86_64",
    "libc": "glibc 2.35",
    "os": "Ubuntu",
    "version": "22.04"
  },
  "record_id": "UAT-002-V103",
  "redaction": {
    "home_path_redacted": true,
    "host_identifier_redacted": true,
    "raw_auth_output_persisted": false,
    "raw_terminal_output_persisted": false,
    "secrets_allowed": false
  },
  "result": "On Ubuntu 22.04/glibc 2.35, the exact final v1.0.3 wheel (SHA-256 68a340ce6af9acadadd1621905f8849a965fa3f8caab0e82ead8077ccc2601d4) replaced PATH precedence over the retained real global-npm command, preserved that command, and migrated a customized schema-0 config to schema 3 with one byte-identical backup and valid diagnostics.",
  "schema_version": 2,
  "started_at": "2026-08-13T09:10:29Z",
  "status": "passed",
  "uat_id": "UAT-002"
}
