{
  "automated_tests": [
    "tests/test_installer.py"
  ],
  "candidate_version": "1.0.3",
  "command": "jarn_installer_tmp=$(mktemp \"${TMPDIR:-/tmp}/jarn-install.XXXXXX\") && trap '[ -z \"${jarn_installer_tmp:-}\" ] || rm -f \"$jarn_installer_tmp\"' 0 HUP INT TERM && curl -fsSL 'https://raw.githubusercontent.com/chayapats/jarn/main/install.sh' -o \"$jarn_installer_tmp\" && sh \"$jarn_installer_tmp\"; jarn_install_rc=$?; [ -z \"${jarn_installer_tmp:-}\" ] || rm -f \"$jarn_installer_tmp\"; trap - 0 HUP INT TERM; if [ \"$jarn_install_rc\" -eq 0 ] || [ \"$jarn_install_rc\" -eq 10 ]; then exec \"$SHELL\" -l; else (exit \"$jarn_install_rc\"); fi",
  "criterion_ids": [
    "UAT-001"
  ],
  "decisions": [],
  "documentation_lookups": [],
  "duration_seconds": 2.0,
  "ended_at": "2026-08-11T19:31:14Z",
  "errors": [],
  "implementation": [
    "install.sh"
  ],
  "limitations": [
    "Resolution=$HOME/.local/bin/jarn; config=present. Provision a new disposable account."
  ],
  "platform": {
    "architecture": "x86_64",
    "libc": "glibc 2.35",
    "os": "ubuntu",
    "version": "22.04"
  },
  "record_id": "UAT-001",
  "redaction": {
    "home_path_redacted": true,
    "host_identifier_redacted": true,
    "raw_auth_output_persisted": false,
    "raw_terminal_output_persisted": false,
    "secrets_allowed": false
  },
  "result": "Fresh-account guard refused to install over existing J.A.R.N. state.",
  "schema_version": 2,
  "started_at": "2026-08-11T19:31:12Z",
  "status": "blocked",
  "uat_id": "UAT-001"
}
